{
  "$schema": "./inventory.schema.json",
  "schema_version": 1,
  "mux_protocol": 12,
  "resource_operations": [
    "agent.list",
    "agent.report",
    "browser.activate",
    "browser.attach",
    "browser.back",
    "browser.close",
    "browser.forward",
    "browser.get",
    "browser.input.key",
    "browser.input.mouse",
    "browser.input.text",
    "browser.input.wheel",
    "browser.list",
    "browser.navigate",
    "browser.reload",
    "browser.viewer.release",
    "browser.viewer.resize",
    "client.cell_pixels.set",
    "client.detach",
    "client.get",
    "client.list",
    "client.metadata.update",
    "client.sizing.release",
    "client.sizing.set",
    "frontend_projection.get",
    "frontend_projection.put",
    "machine.get",
    "machine.list",
    "notification.ack",
    "notification.clear",
    "notification.create",
    "notification.list",
    "pairing_request.list",
    "pairing_request.resolve",
    "pane.close",
    "pane.create",
    "pane.focus",
    "pane.focus_direction",
    "pane.get",
    "pane.list",
    "pane.neighbor.get",
    "pane.rename",
    "pane.run",
    "pane.split",
    "pane.split_ratio.set",
    "pane.swap",
    "pane.viewport_width.set",
    "pane.zoom",
    "request.cancel",
    "screen.close",
    "screen.create",
    "screen.focus",
    "screen.get",
    "screen.layout.export",
    "screen.layout.undo",
    "screen.list",
    "screen.rename",
    "session.creation.resolve",
    "session.events",
    "session.get",
    "session.journal.append",
    "session.journal.checkpoint.create",
    "session.journal.checkpoint.list",
    "session.journal.hook.list",
    "session.journal.hook.put",
    "session.journal.producer.list",
    "session.journal.producer.put",
    "session.journal.restore.preview",
    "session.journal.segment.list",
    "session.journal.segment.seal",
    "session.journal.subscribe",
    "session.list",
    "session.open",
    "session.ping",
    "session.reload_config",
    "session.shutdown",
    "session.snapshot",
    "session.terminal_defaults.update",
    "session.window.title.clear",
    "session.window.title.set",
    "sidebar_view.attach",
    "sidebar_view.ensure",
    "sidebar_view.get",
    "sidebar_view.input",
    "sidebar_view.reload",
    "sidebar_view.resize",
    "stream.cancel",
    "tab.close",
    "tab.create_browser",
    "tab.create_terminal",
    "tab.focus",
    "tab.get",
    "tab.list",
    "tab.move",
    "tab.rename",
    "terminal.attach",
    "terminal.close",
    "terminal.copy",
    "terminal.get",
    "terminal.history.clear",
    "terminal.history.read",
    "terminal.input.focus",
    "terminal.input.keys",
    "terminal.input.mouse",
    "terminal.input.write",
    "terminal.list",
    "terminal.move",
    "terminal.output_read",
    "terminal.process.get",
    "terminal.project",
    "terminal.renderer_grant.create",
    "terminal.screen.read",
    "terminal.state.read",
    "terminal.viewer.release",
    "terminal.viewer.resize",
    "terminal.viewport.scroll",
    "terminal.wait",
    "terminal.wait_exit",
    "workspace.close",
    "workspace.create",
    "workspace.focus",
    "workspace.get",
    "workspace.layout.apply",
    "workspace.list",
    "workspace.move",
    "workspace.rename",
    "workspace.run"
  ],
  "profiles": {
    "control": "Base authenticated session-control commands available to ordinary SDK clients.",
    "frontend": "Additional rendering, input, and presentation commands; the effective frontend profile inherits control.",
    "local-admin": "Additional commands accepted on a trusted Unix-classified transport; direct Unix and current stdio relay inherit control plus this group.",
    "provider-authority": "Additional provider-owned workspace mutations; the effective profile inherits control and requires separately provisioned authority."
  },
  "commands": {
    "control": [
      "apply-layout",
      "clear-history",
      "clear-window-title",
      "client-focus",
      "close-pane",
      "close-screen",
      "close-surface",
      "close-terminal",
      "close-workspace",
      "copy",
      "create-surface-with-receipt",
      "create-terminal",
      "create-workspace",
      "detach-client",
      "export-layout",
      "focus-direction",
      "focus-pane",
      "get-frontend-projection",
      "identify",
      "ids",
      "journal-frontend-event",
      "list-agents",
      "list-clients",
      "list-terminals",
      "list-workspaces",
      "machine-listening-tcp",
      "machine-usage",
      "move-tab",
      "move-terminal",
      "move-workspace",
      "new-browser-tab",
      "new-pane",
      "new-pane-right",
      "new-screen",
      "new-tab",
      "new-workspace",
      "notify",
      "pane-neighbor",
      "paste-image",
      "ping",
      "presence-clear",
      "presence-list",
      "presence-update",
      "process-info",
      "put-frontend-projection",
      "read-screen",
      "read-scrollback",
      "release-surface-size",
      "reload-config",
      "rename-pane",
      "rename-screen",
      "rename-surface",
      "rename-workspace",
      "report-agent",
      "report-focus",
      "resize-surface",
      "resolve-terminal",
      "run",
      "scroll-surface",
      "select-screen",
      "select-tab",
      "select-workspace",
      "send",
      "send-key",
      "set-client-info",
      "set-client-sizing",
      "set-default-colors",
      "set-ratio",
      "set-split-ratio",
      "set-viewport-pane-width",
      "set-window-title",
      "split",
      "swap-pane",
      "terminal-events",
      "undo-layout",
      "vt-state",
      "wait-for",
      "zoom-pane"
    ],
    "frontend": [
      "sidebar-plugin",
      "mint-terminal-renderer",
      "get-cell-pixels",
      "mint-terminal-renderer-by-terminal",
      "set-cell-pixels",
      "browser-frame-presented",
      "browser-mouse",
      "browser-mouse-guarded",
      "browser-wheel",
      "browser-wheel-guarded",
      "browser-key",
      "browser-key-press",
      "browser-insert-text",
      "browser-navigate",
      "browser-back",
      "browser-forward",
      "browser-reload",
      "browser-activate",
      "subscribe",
      "attach-surface",
      "resize-attached-view",
      "release-attached-view-size",
      "detach-attached-view"
    ],
    "local-admin": [
      "server-stats",
      "register-browser-provider",
      "get-browser-provider",
      "unregister-browser-provider",
      "shutdown-daemon",
      "pairing-response"
    ],
    "provider-authority": [
      "mark-workspaces-provider-managed",
      "close-provider-managed-workspace",
      "rename-provider-managed-workspace"
    ]
  },
  "events": [
    {
      "name": "agent-changed",
      "streams": [
        "subscribe"
      ]
    },
    {
      "name": "bell",
      "streams": [
        "subscribe"
      ]
    },
    {
      "name": "browser-state",
      "streams": [
        "attach-browser"
      ]
    },
    {
      "name": "client-attached",
      "streams": [
        "subscribe"
      ]
    },
    {
      "name": "client-changed",
      "streams": [
        "subscribe"
      ]
    },
    {
      "name": "client-detached",
      "streams": [
        "subscribe"
      ]
    },
    {
      "name": "client-list-invalidated",
      "streams": [
        "subscribe"
      ],
      "emission": "serialized-never-emitted"
    },
    {
      "name": "colors-changed",
      "streams": [
        "attach-byte"
      ]
    },
    {
      "name": "config-reload-requested",
      "streams": [
        "subscribe"
      ]
    },
    {
      "name": "daemon-shutdown",
      "streams": [
        "control"
      ]
    },
    {
      "name": "detached",
      "streams": [
        "attach-byte",
        "attach-render",
        "attach-browser"
      ]
    },
    {
      "name": "empty",
      "streams": [
        "subscribe"
      ]
    },
    {
      "name": "frame",
      "streams": [
        "attach-browser"
      ]
    },
    {
      "name": "frontend-projection-changed",
      "streams": [
        "subscribe"
      ]
    },
    {
      "name": "graphics-status",
      "streams": [
        "subscribe"
      ]
    },
    {
      "name": "layout-changed",
      "streams": [
        "subscribe"
      ]
    },
    {
      "name": "machine-usage-changed",
      "streams": [
        "subscribe"
      ]
    },
    {
      "name": "notification",
      "streams": [
        "subscribe",
        "attach-byte",
        "attach-browser"
      ]
    },
    {
      "name": "output",
      "streams": [
        "attach-byte"
      ]
    },
    {
      "name": "overflow",
      "streams": [
        "subscribe",
        "attach-byte",
        "attach-render",
        "attach-browser"
      ]
    },
    {
      "name": "pairing-requested",
      "streams": [
        "subscribe"
      ]
    },
    {
      "name": "pairing-resolved",
      "streams": [
        "subscribe"
      ]
    },
    {
      "name": "pane-added",
      "streams": [
        "subscribe-deltas"
      ]
    },
    {
      "name": "pane-closed",
      "streams": [
        "subscribe-deltas"
      ]
    },
    {
      "name": "presence-changed",
      "streams": [
        "subscribe"
      ]
    },
    {
      "name": "render-delta",
      "streams": [
        "attach-render"
      ]
    },
    {
      "name": "render-state",
      "streams": [
        "attach-render"
      ]
    },
    {
      "name": "resized",
      "streams": [
        "attach-byte"
      ]
    },
    {
      "name": "screen-added",